{
  "format": "connection-analysis-layout",
  "schema_version": "1.0",
  "analysis_schema_version": "1.0",
  "camera": {
    "x": 140,
    "y": 65,
    "zoom": 1.25
  },
  "nodes": {
    "python:app.py:module": {"x": 100, "y": 50},
    "python:app.py:main:function": {"x": 180, "y": 80}
  },
  "annotations": []
}
